Caption,Option 1,Option 2,Sponsor?,id,UGC?
,Have the opportunity to collaborate on a song with your favorite musician ,Have a guest appearance in a popular television series,FALSE,n/a,FALSE
,Have the power to bring back a beloved Asian TV show for another season,Have the ability to revive a disbanded K-pop group,FALSE,n/a,FALSE
,Have to say IJBOL out loud every time you laugh,Have to narrate your own life like a vlogger,FALSE,n/a,FALSE
,Have unlimited free Wi-Fi for life but every webpage takes 10 seconds to load,Have lightning-fast internet but every online purchase requires a 24-hour waiting period before it's confirmed,FALSE,n/a,FALSE
,"Live in a huge mansion but only be allowed to eat bland, unseasoned food",Live in a tiny house but have the most amazing gourmet meals every day,FALSE,n/a,FALSE
,Only watch YouTube Shorts forever,Only watch Instagram Reels forever,FALSE,n/a,FALSE
,SAMSUNG,APPLE,FALSE,n/a,FALSE
,Take care of animals in a shelter,Take care of children in an orphanage,FALSE,n/a,FALSE
,You can never sing your fav songs,You can never hear your fav songs,FALSE,n/a,FALSE
,be smart,be diligent,FALSE,n/a,FALSE
Try this…,Super handsome but never gonna own/spend a penny,Super rich but unacceptably ugly,FALSE,n/a,TRUE
,Jokic,Doncic,FALSE,n/a,TRUE
who is the better character?,Kim Shin (Guardian: The lonely & Great God),Yeom Mi-jeong (My liberation Notes),FALSE,n/a,TRUE
,have bad luck in the kitchen,had bad luck in the bedroom,FALSE,n/a,TRUE
,chinese kung fu,japanese karate,FALSE,n/a,TRUE
Best Arya Stark quote,Not today.,A girl has no name.,FALSE,n/a,TRUE
Which anime,SPY×FAMILY,The Apothecary Diaries,FALSE,n/a,TRUE
Who would you rather have on your side,Daenerys Targaryen,Arya Stark,FALSE,n/a,TRUE
,Attend a BTS concert,Attend a Blackpink concert,FALSE,n/a,FALSE
,Be able to control time,Be able to alter reality,FALSE,n/a,FALSE
,Explore the depths of the ocean,Explore outer space,FALSE,n/a,FALSE
,"Find your forever love on ""Love is Blind""","Find a hot flilng on ""Too Hot To Handle""",FALSE,n/a,FALSE
,Get to have a dinner with your childhood hero,Get to have a dinner with your celebrity crush,FALSE,n/a,FALSE
,Have a cool futuristic robotic arm,Have a neural implant that lets you download skills like The Matrix,FALSE,n/a,FALSE
,Have a guaranteed income of $1 million per year for the rest of your life,Have the bility to invent one groundbreaking invention?,FALSE,n/a,FALSE
,Have a lifetime supply of your favorite brand's products but never be able to try any other brands,Have the opporutnity to test and reviwe new products before they hit the market but never receive any freebies from your favorite brand again,FALSE,n/a,FALSE
,Have a personal VR gaming setup with unlimited access to all the latest games,Have a private home theater with a massive screen for movie marathons,FALSE,n/a,FALSE
,Have a pet dinosaur,Have a pet dragon,FALSE,n/a,FALSE
,Have a professor who cancels all exams but assigns double the amount of essays,Have a personal tutor who can explain any complex topic to you but they have an annoying habit of speaking only in rhymes,FALSE,n/a,FALSE
,Have the ability to attend any music festival in Asia,Have backstage access to all the major award shows in the region,FALSE,n/a,FALSE
,Have the ability to change your appearance at will,Have the ability to change your voice at will,FALSE,n/a,FALSE
,Have the ability to instantly recover from any hangover but you can only communicate in limericks for 24 hours,Have the ability to instantly recover from any hangover but you can only communicate in limericks for 24 hours,FALSE,n/a,FALSE
,Have the power to bring peace to the world,Have unlimited wealth,FALSE,n/a,FALSE
,Have the power to instantly learn and master any dance move,Have the ability to sing like a famous artist for one night only,FALSE,n/a,FALSE
,Have the talent to create your own popular webcomic,Have the opportunity to collaborate with a famous Asian comic artist on a project,FALSE,n/a,FALSE
,Have unlimited data on phone,Have unlimited battery life on phone,FALSE,n/a,FALSE
,Have your dream job,Find your true love,FALSE,n/a,FALSE
,Live in an apartment,Live in a house,FALSE,n/a,FALSE
,Live without the internet,Live without music,FALSE,n/a,FALSE
,Not sleep more than 2 hours for a year but make enough to retire in 10 years time,Sleep 8 hours every day for your whole life but you have to work until you're 70,FALSE,n/a,FALSE
,Play Fortnite for 48 hours straight,Play PUBG for 48 hours straight,FALSE,n/a,FALSE
,Solve a great mystery of the past,Discover a great secret of the universe,FALSE,n/a,FALSE
Pick your hero,Captain America,Iron Man,FALSE,n/a,TRUE
who's the better character?,Hwang Do-hee (Queenmaker),Seong Gi-hun (Squid Game),FALSE,n/a,TRUE
,Jujutsu Kaisen,Windbreaker,FALSE,n/a,TRUE
,To the moon,Go to zero,FALSE,n/a,TRUE
,double jump and dash like jett in real life,be able to drink speed and strength potions in real life,FALSE,n/a,TRUE
,phoenix,Reyna,FALSE,n/a,TRUE
Instantly know how to play the,Guitar,Saxophone,FALSE,n/a,TRUE
,Be able to breathe underwater,Be able to walk on walls like Spiderman,FALSE,n/a,FALSE
,Have a laptop with unlimited battery life but it can only access educational websites,Have a smartwatch that can instantly solve any math problem but it occasionally beeps loudly during lectures,FALSE,n/a,FALSE
,Have a personal chef who can cook any dish you want but it always tastes like cardboard,Have a personal chef who can only cook macaroni and cheese but it's the most delicious mac and cheese in the world,FALSE,n/a,FALSE
,Have a photographic memory,Have an incredibly high IQ,FALSE,n/a,FALSE
,Have the power to control people's emotions but you can never experience emotions yourself,Have the ability to feel all emotions intensely but have no control over them,FALSE,n/a,FALSE
,"Have the power to control time during work hours, but it also means you have to endure a daily dance-off with your boss",Have a job that pays a ridiculously high salary but requires you to wear cosplay every day,FALSE,n/a,FALSE
,Have to wear formal attire everywhere you go,Have to wear pajamas everywhere you go,FALSE,n/a,FALSE
,Live in Minecraft world,Live in Roblox world,FALSE,n/a,FALSE
,Have a personal chef,Have a personal driver,FALSE,n/a,TRUE
,200 friends but each friend has a bad habit,1 friend but that friend only has good habits,FALSE,n/a,TRUE
,Cook in basketball,Cook in gaming,FALSE,n/a,TRUE
,Kaiju no. 8,Mashle: Magic and Muscles,FALSE,n/a,TRUE
,Work in the government,work with the government,FALSE,n/a,TRUE
,radiant in valorant but have no skins,iron in valorant but have all skins,FALSE,n/a,TRUE
,study economics,study computer science,FALSE,n/a,TRUE
,Join the Heroes,Join the Villains,FALSE,n/a,FALSE
,SAMSUNG,APPLE,FALSE,n/a,FALSE
,After Effects,Premiere Pro,FALSE,n/a,TRUE